{
  "service": "michi-music-player",
  "name": "Michi Music Player",
  "server_id": "b1a2c3d4-e5f6-7890-abcd-ef1234567890",
  "version": "0.1.0",
  "api_version": "v1",
  "michi_link_version": "1.0.0-alpha",
  "roles": ["desktop_player", "library_master", "sync_host", "sync_source", "stream_server"],
  "features": {
    "library": true,
    "search": true,
    "streaming": true,
    "sync_manifest": true,
    "playback": true,
    "queue": true,
    "artwork": true,
    "events": false
  },
  "auth": { "required": true, "strategy": "PLAYER_PASSWORD", "token_refresh": false }
}
